schema_name_source,schema_name,column_name_source,column_name,group,description
precancerous_lesions_schema,precancerous_lesions,diagnosis_pl_degree_text,diagnosis_pl_degree_text,diagnosis,"Clinician-rated degree of dysphonia recorded as a numeric slider value from 0–100, with an accompanying C/I classification and optional free-text entries for the nature of the dysphonia, additional features, and resonance (noted as ""normal"" or ""Other"" with free-text if Other)."
precancerous_lesions_schema,precancerous_lesions,diagnosis_pl_ds,diagnosis_pl_ds,diagnosis,"Diagnosis for the participant's precancerous lesion(s), recorded as one or more selected diagnostic categories (multiple selections allowed)."
precancerous_lesions_schema,precancerous_lesions,diagnosis_pl_ds_e,diagnosis_pl_ds_e,diagnosis,"Indicates whether the participant has a clinical diagnosis of erythroplakia (a red, potentially precancerous lesion of the oral mucosa), recorded as Yes or No."
precancerous_lesions_schema,precancerous_lesions,diagnosis_pl_ds_e_wd_g,diagnosis_pl_ds_e_wd_g,diagnosis,Indicates whether the participant has a diagnosis of erythroplakia with dysplasia (recorded as yes/no or present/absent).
precancerous_lesions_schema,precancerous_lesions,diagnosis_pl_ds_k,diagnosis_pl_ds_k,diagnosis,"Indicates whether the participant has a clinical diagnosis of keratosis (e.g., actinic or seborrheic), typically recorded as present/absent."
precancerous_lesions_schema,precancerous_lesions,diagnosis_pl_ds_k_wd_g,diagnosis_pl_ds_k_wd_g,diagnosis,"Indicates whether the participant had keratosis with dysplasia, a precancerous lesion, recorded as present or absent (yes/no)."
precancerous_lesions_schema,precancerous_lesions,diagnosis_pl_ds_l,diagnosis_pl_ds_l,diagnosis,"Indicates whether leukoplakia — a white, potentially precancerous patch on the oral mucosa — is present on the left side of the mouth (e.g., recorded as present/absent/unknown)."
precancerous_lesions_schema,precancerous_lesions,diagnosis_pl_ds_l_wd_g,diagnosis_pl_ds_l_wd_g,diagnosis,"Indicates whether the participant has been diagnosed with leukoplakia with epithelial dysplasia (a precancerous oral white patch), recorded as present/absent (yes/no)."
precancerous_lesions_schema,precancerous_lesions,diagnosis_pl_ds_ll,diagnosis_pl_ds_ll,diagnosis,"Anatomical site(s) of the precancerous lesion(s), recorded by selecting one or more predefined locations (multiple responses allowed)."
precancerous_lesions_schema,precancerous_lesions,diagnosis_pl_ds_other,diagnosis_pl_ds_other,diagnosis,Free-text field to specify any other precancerous lesion diagnosis not listed in the predefined choices (enter the diagnosis name or brief description).
precancerous_lesions_schema,precancerous_lesions,diagnosis_pl_etiology,diagnosis_pl_etiology,diagnosis,"Lists the etiologic risk factors present for the participant's precancerous lesion, allowing multiple selections (e.g., HPV infection, tobacco use, heavy alcohol use, gastroesophageal reflux, prior radiation exposure, immunosuppression)."
precancerous_lesions_schema,precancerous_lesions,diagnosis_pl_etiology_other,diagnosis_pl_etiology_other,diagnosis,"Free-text entry listing any other irritants reported as contributing to the participant’s precancerous lesion(s) (i.e., causes not covered by the predefined options)."
precancerous_lesions_schema,precancerous_lesions,diagnosis_pl_gsd,diagnosis_pl_gold_standard_diagnosis,diagnosis,Indicates whether the participant has a precancerous vocal fold lesion (Yes/No).
precancerous_lesions_schema,precancerous_lesions,diagnosis_pl_gsd_confirmation_method,diagnosis_pl_gold_standard_diagnosis_confirmation_method,diagnosis,"Method(s) used to confirm the precancerous lesion diagnosis, allowing one or more selections (e.g., biopsy/histopathology, cytology, clinical examination, imaging, or laboratory/HPV testing)."
precancerous_lesions_schema,precancerous_lesions,diagnosis_pl_treatment,diagnosis_pl_treatment,diagnosis,Indicates whether the participant has undergone any treatment for this precancerous lesion (recorded as Yes/No).
precancerous_lesions_schema,precancerous_lesions,diagnosis_pl_treatment_other,diagnosis_pl_treatment_other,diagnosis,Free-text entry to describe any other treatment(s) received for precancerous lesions that are not listed among the predefined options.
precancerous_lesions_schema,precancerous_lesions,diagnosis_pl_treatment_select,diagnosis_pl_treatment_select,diagnosis,"Specifies which treatments the participant underwent for precancerous lesions, allowing multiple selections (e.g., excision, ablation/cryotherapy, topical or systemic therapy, radiation, other)."
productive_vocabulary_schema,productive_vocabulary,vocabulary_duration,vocabulary_duration,questionnaire,"Elapsed time in seconds from the start to the completion of the productive vocabulary questionnaire, recorded as a non-negative numeric value."
productive_vocabulary_schema,productive_vocabulary,vocabulary_item_correct_1,vocabulary_item_correct_1,questionnaire,Indicates whether the participant correctly produced Item 1 of the productive vocabulary task (binary: Yes/No).
productive_vocabulary_schema,productive_vocabulary,vocabulary_item_correct_2,vocabulary_item_correct_2,questionnaire,"Indicates whether the participant correctly produced productive vocabulary item 2, recorded as a binary response (Yes/No or 1/0)."
productive_vocabulary_schema,productive_vocabulary,vocabulary_item_correct_3,vocabulary_item_correct_3,questionnaire,"Indicates whether the participant correctly produced vocabulary item 3, recorded as a binary response (e.g., Yes/No or Correct/Incorrect, often encoded 1/0)."
productive_vocabulary_schema,productive_vocabulary,vocabulary_item_correct_4,vocabulary_item_correct_4,questionnaire,Indicates whether the participant correctly produced vocabulary Item 4 during the productive vocabulary assessment (binary: correct or incorrect).
productive_vocabulary_schema,productive_vocabulary,vocabulary_item_correct_5,vocabulary_item_correct_5,questionnaire,Indicates whether the participant correctly produced vocabulary item 5 during the expressive vocabulary task (recorded as correct or incorrect).
productive_vocabulary_schema,productive_vocabulary,vocabulary_item_correct_6,vocabulary_item_correct_6,questionnaire,Indicates whether the participant produced item 6 correctly on the productive vocabulary assessment (response: correct or incorrect).
productive_vocabulary_schema,productive_vocabulary,vocabulary_item_difficulty_1,vocabulary_item_difficulty_1,questionnaire,"Participant-reported difficulty for vocabulary item 1, recorded using the study's difficulty scale (e.g., labels like ""easy""/""medium""/""hard"" or corresponding ordinal values)."
productive_vocabulary_schema,productive_vocabulary,vocabulary_item_difficulty_2,vocabulary_item_difficulty_2,questionnaire,"Rater or participant judgment of how difficult vocabulary item 2 was, recorded as an ordinal difficulty rating or category (for example, a numeric scale or labels such as ""easy""/""moderate""/""hard"")."
productive_vocabulary_schema,productive_vocabulary,vocabulary_item_difficulty_3,vocabulary_item_difficulty_3,questionnaire,"Participant's perceived difficulty of the third productive vocabulary item, recorded as the item's difficulty rating on the study's response scale."
productive_vocabulary_schema,productive_vocabulary,vocabulary_item_difficulty_4,vocabulary_item_difficulty_4,questionnaire,"Rated difficulty of vocabulary item 4, recording how hard that word was judged on the study’s predefined response scale (for example, categorical labels like ""easy/medium/hard"" or a numeric score)."
productive_vocabulary_schema,productive_vocabulary,vocabulary_item_difficulty_5,vocabulary_item_difficulty_5,questionnaire,Difficulty level of vocabulary item 5 as reported by the participant or assessor (response scale/options not specified).
productive_vocabulary_schema,productive_vocabulary,vocabulary_item_difficulty_6,vocabulary_item_difficulty_6,questionnaire,"Participant- or caregiver-rated difficulty of vocabulary item 6, recorded on the study's difficulty scale (for example, a numeric 1–5 scale with higher values indicating more difficulty or categorical labels such as ""easy"", ""moderate"", ""difficult"")."
productive_vocabulary_schema,productive_vocabulary,vocabulary_item_word_1,vocabulary_item_word_1,questionnaire,First productive vocabulary item: the participant-provided single-word response recorded as free-text (text string).
productive_vocabulary_schema,productive_vocabulary,vocabulary_item_word_2,vocabulary_item_word_2,questionnaire,"Single-word, free-text response capturing the participant’s produced word for productive vocabulary Item 2."
productive_vocabulary_schema,productive_vocabulary,vocabulary_item_word_3,vocabulary_item_word_3,questionnaire,"The third productive vocabulary item: the single word produced or recorded for item 3, captured as a free-text string."
productive_vocabulary_schema,productive_vocabulary,vocabulary_item_word_4,vocabulary_item_word_4,questionnaire,"The single word produced by the participant for productive vocabulary item 4 (free-text, single-word response)."
productive_vocabulary_schema,productive_vocabulary,vocabulary_item_word_5,vocabulary_item_word_5,questionnaire,Single-word text response provided by the participant for productive vocabulary item 5.
productive_vocabulary_schema,productive_vocabulary,vocabulary_item_word_6,vocabulary_item_word_6,questionnaire,The single-word free-text response provided by the participant for productive vocabulary item 6.
productive_vocabulary_schema,productive_vocabulary,vocabulary_recording_acoustic_task_id,vocabulary_recording_acoustic_task_id,questionnaire,"Alphanumeric identifier for the acoustic recording task associated with the productive vocabulary assessment, used to link audio files to the specific task."
productive_vocabulary_schema,productive_vocabulary,vocabulary_session_id,vocabulary_session_id,questionnaire,Alphanumeric identifier uniquely labeling the productive vocabulary assessment session (string format) used to link participant- and visit-specific data.
ptsd_adult_schema,ptsd_adult,avoiding_reminders,avoiding_reminders,diagnosis,"Participant-reported degree or frequency of trying to avoid thoughts, feelings, or physical sensations that remind them of a stressful experience (typically recorded as a Likert-style severity/frequency rating)."
ptsd_adult_schema,ptsd_adult,emotionally_upset,emotionally_upset,diagnosis,"Self-reported degree to which the respondent felt very emotionally upset when reminded of a stressful experience, recorded on a Likert severity scale (e.g., not at all to extremely)."
ptsd_adult_schema,ptsd_adult,feeling_jumpy,feeling_jumpy,diagnosis,"Whether the participant feels jumpy or easily startled by unexpected noises, usually recorded as yes/no or on a severity scale (e.g., not at all to extremely)."
ptsd_adult_schema,ptsd_adult,flashbacks,flashbacks,diagnosis,"Indicates whether the participant has experienced flashbacks—sudden re‑experiencing of a past stressful event (e.g., seeing, hearing, smelling, or physically feeling parts of the event)—recorded as presence/absence (yes/no)."
ptsd_adult_schema,ptsd_adult,irritable,irritable,diagnosis,"Indicates whether the participant experienced extreme irritability or anger (e.g., yelling at others, getting into fights, or destroying things), recorded as a yes/no response."
ptsd_adult_schema,ptsd_adult,losing_interest,losing_interest,diagnosis,"Indicates whether the participant has experienced reduced interest in activities they previously enjoyed since the stressful experience, typically recorded as presence/absence or a frequency/severity rating."
ptsd_adult_schema,ptsd_adult,neg_emotional_state,neg_emotional_state,diagnosis,"Indicates whether the participant experienced a very negative emotional state (e.g., intense fear, anger, guilt, shame, or horror) after the stressful event, recorded as presence/absence or as a severity/frequency rating."
ptsd_adult_schema,ptsd_adult,ptsd_duration,ptsd_duration,diagnosis,"Total time in seconds from the start to the completion of the PTSD questionnaire, representing how long the participant took to complete it."
ptsd_adult_schema,ptsd_adult,ptsd_session_id,ptsd_session_id,diagnosis,Unique alphanumeric identifier for each participant's PTSD assessment session used to distinguish and link individual visits.
ptsd_adult_schema,ptsd_adult,super_alert,super_alert,diagnosis,"Extent to which the participant felt ""super alert,"" on guard, or constantly on the lookout for danger, typically recorded on a symptom severity scale (e.g., not at all to extremely)."
ptsd_adult_schema,ptsd_adult,thinking_stressful_event,thinking_stressful_event,diagnosis,"Indicates whether the participant believes the stressful event occurred because they or someone else (who did not directly harm them) did something wrong or failed to prevent it, or because of something about them, typically recorded as a categorical response (e.g., yes/no or degree of agreement)."
ptsd_adult_schema,ptsd_adult,traumatic_event,traumatic_event,diagnosis,Participant's brief free-text description of the traumatic event they experienced (open-text response).
random_item_generation_schema,random_item_generation,random_duration,random_duration,task,"Total elapsed time, in seconds, taken to complete the questionnaire."
random_item_generation_schema,random_item_generation,random_item_generation_category,random_item_generation_category,task,"Category of items a participant generated during the random item generation task (e.g., words, numbers, letters, or sounds)."
random_item_generation_schema,random_item_generation,random_recording_acoustic_task_id,random_recording_acoustic_task_id,task,"Alphanumeric identifier for the specific acoustic task performed during the recording (a short label or code that distinguishes tasks such as sustained vowel, reading passage, or spoken prompt)."
random_item_generation_schema,random_item_generation,random_session_id,random_session_id,task,Unique alphanumeric identifier assigned to each recording session to distinguish and link session-level data.
recording_schema,recording,recording_acoustic_task_id,recording_acoustic_task_id,task,"Unique identifier or label for the specific acoustic task performed during the recording, typically a short code or descriptive name (e.g., sustained_vowel, reading_passage)."
recording_schema,recording,recording_duration,recording_duration,task,"Total length of the audio recording, reported in seconds."
recording_schema,recording,recording_id,recording_id,task,"Unique alphanumeric identifier for each audio recording in the dataset (no units), used to link the audio file to the corresponding participant and session."
recording_schema,recording,recording_input_gain,recording_input_gain,task,"Numeric value indicating the amount of amplification applied to the recording input at capture, reported as a gain setting (typically in decibels [dB] or device-specific units)."
recording_schema,recording,recording_microphone,recording_microphone,task,"Type or model of the microphone or recording device used for the session (e.g., built-in laptop mic, smartphone [include model], external USB/microphone, headset, or lavalier), with brand/model details if known."
recording_schema,recording,recording_name,recording_name,task,"Name of the audio recording file — a short text label or filename that uniquely identifies the recording (e.g., participantID_task_timestamp)."
recording_schema,recording,recording_profile_name,recording_profile_name,task,"Name of the recording profile used for this audio session, recorded as a short text label identifying the device or configuration (for example, ""LaptopMic"", ""ExternalMic"", or ""QuietRoom"")."
recording_schema,recording,recording_profile_version,recording_profile_version,task,"Identifier for the recording profile version used during the session, recorded as a string or numeric version identifier (e.g., ""v1.2"" or ""2023-01-01"")."
recording_schema,recording,recording_session_id,recording_session_id,task,Unique alphanumeric identifier for the recording session that links audio data to a specific participant visit or session.
recording_schema,recording,recording_size,recording_size,task,"Size of the audio recording file on disk, expressed as a numeric value in kibibytes (KiB)."
session_schema,session,session_assigned_tasks,session_assigned_tasks,task,"Names or codes of the tasks assigned to the participant for this session, recorded as a comma-separated list (e.g., free_speech, read_aloud, sentence_repetition)."
session_schema,session,session_completed_by,session_completed_by,task,"Identifies who assisted the participant in providing answers during the session (e.g., self/no one, spouse/partner, family member, caregiver, friend, clinician, or other)."
session_schema,session,session_duration,session_duration,task,"Total elapsed duration of the session in seconds, recorded as a numeric value."
session_schema,session,session_id,session_id,task,"Unique alphanumeric identifier for this participant session (string), used to link data collected during the same visit or recording."
session_schema,session,session_is_control_participant,session_is_control_participant,task,Indicates whether the participant for this session is a control participant (binary response: Yes/No).
session_schema,session,session_status,session_status,task,"Indicates the overall state of the session (e.g., completed, in_progress, incomplete/partial, canceled, or aborted), capturing whether data collection for that session was finished."
subjectparticipant_basic_information_schema,participant,record_id,participant_id,enrollment,Unique alphanumeric identifier assigned to each participant record to link and match their deidentified data across files.
subjectparticipant_basic_information_schema,participant,selected_language,selected_language,enrollment,"Participant's primary or preferred language for communication, recorded as the language name (e.g., English, Spanish)."
subjectparticipant_basic_information_schema,participant,selected_language_2,selected_language_2,enrollment,"The participant’s preferred language for the session or assessment, recorded as the name of the language (e.g., English, Spanish, Mandarin)."
subjectparticipant_eligible_studies_schema,participant,add_adhd,self_reported_add_adhd,enrollment,"Indicates whether the participant self-reported a diagnosis of Attention-Deficit/Hyperactivity Disorder (ADHD); response options typically: Yes, No, or Unknown."
subjectparticipant_eligible_studies_schema,participant,airway_stenosis,self_reported_airway_stenosis,enrollment,"Indicates whether the participant self-reported a diagnosis of airway stenosis (narrowing of the airway), such as bilateral vocal fold paralysis or laryngeal stenosis; typically recorded as ""Yes"" or ""No"" (or ""Unknown"" if not determined)."
subjectparticipant_eligible_studies_schema,participant,alcohol_subst_abuse,self_reported_alcohol_subst_abuse,enrollment,"Indicates whether the participant self-reported a current or past diagnosis of alcohol or other substance use disorder (e.g., alcohol, opioids, stimulants), typically recorded as Yes/No/Unknown."
subjectparticipant_eligible_studies_schema,participant,als,self_reported_als,enrollment,Indicates whether the participant self-reported a diagnosis of amyotrophic lateral sclerosis (ALS); responses: Yes or No.
subjectparticipant_eligible_studies_schema,participant,alz_dementia_mci,self_reported_alz_dementia_mci,enrollment,"Indicates whether the participant self-reported a diagnosis of Alzheimer's disease, another form of dementia, or mild cognitive impairment (MCI); responses are typically Yes/No (and may include Unknown)."
subjectparticipant_eligible_studies_schema,participant,asd,self_reported_asd,enrollment,"Indicates whether the participant self-reported a diagnosis of Autism Spectrum Disorder (ASD), typically recorded as ""yes"" or ""no."""
subjectparticipant_eligible_studies_schema,participant,asthma,self_reported_asthma,enrollment,"Indicates whether the participant self-reported a diagnosis of asthma (presence/absence), typically recorded as Yes or No."
subjectparticipant_eligible_studies_schema,participant,autism,self_reported_autism,enrollment,"Indicates whether the participant self-reported a diagnosis of Autism Spectrum Disorder (ASD), with responses such as ""yes"", ""no"", or ""unknown/not reported."""
subjectparticipant_eligible_studies_schema,participant,benign_cord_lesion,self_reported_benign_cord_lesion,enrollment,"Indicates whether the participant self-reported a diagnosis of benign vocal cord lesion (nodule, polyp, or cyst), typically recorded as Yes/No."
subjectparticipant_eligible_studies_schema,participant,bipolar,self_reported_bipolar,enrollment,"Indicates whether the participant self-reported a diagnosis of Bipolar Disorder, recorded as Yes or No."
subjectparticipant_eligible_studies_schema,participant,bpd,self_reported_bpd,enrollment,"Indicates whether the participant self-reported a diagnosis of Borderline Personality Disorder (BPD); typically recorded as Yes, No, or Unknown."
subjectparticipant_eligible_studies_schema,participant,chronic_cough,self_reported_chronic_cough,enrollment,"Indicates whether the participant self-reported a chronic (long-lasting or persistent) cough, recorded as ""Yes"" or ""No."""
subjectparticipant_eligible_studies_schema,participant,cond_sel_prompt,cond_sel_prompt,enrollment,"Self-reported checklist of medical/health conditions the participant currently has, captured as multiple selectable options (check all that apply)."
subjectparticipant_eligible_studies_schema,participant,copd,self_reported_copd,enrollment,"Indicates whether the participant self-reported a diagnosis of chronic obstructive pulmonary disease (COPD), typically recorded as Yes, No, or Unknown."
subjectparticipant_eligible_studies_schema,participant,depression,self_reported_depression,enrollment,"Indicates whether the participant self-reported a diagnosis of depression (Major Depressive Disorder), recorded as Yes or No."
subjectparticipant_eligible_studies_schema,participant,ed,self_reported_ed,enrollment,"Indicates whether the participant self-reported a current or past eating disorder diagnosis (e.g., anorexia nervosa, bulimia nervosa, binge‑eating disorder), typically recorded as yes/no with an option to specify the disorder type."
subjectparticipant_eligible_studies_schema,participant,eligible_studies,eligible_studies,enrollment,"Names or codes of the study or studies for which the participant is eligible, recorded as one or more study IDs or names (multiple entries allowed)."
subjectparticipant_eligible_studies_schema,participant,gad,self_reported_gad,enrollment,Indicates whether the participant self-reported a diagnosis of an anxiety disorder (response options: Yes / No / Unknown).
subjectparticipant_eligible_studies_schema,participant,glottic_insufficiency,self_reported_glottic_insufficiency,enrollment,"Indicates whether the participant self-reported a diagnosis of glottic insufficiency (including age-related presbyphonia), recorded as present, absent, or unknown."
subjectparticipant_eligible_studies_schema,participant,huntingtons,self_reported_huntingtons,enrollment,Indicates whether the participant self-reported a diagnosis of Huntington’s disease (typical responses: Yes / No / Unknown).
subjectparticipant_eligible_studies_schema,participant,insomnia,self_reported_insomnia,enrollment,"Indicates whether the participant self-reported insomnia or another sleep disorder (self-reported or clinically diagnosed), recorded as Yes/No/Unknown."
subjectparticipant_eligible_studies_schema,participant,is_control_participant,is_control_participant,enrollment,"Indicates whether the participant is a control (i.e., not having the target condition), recorded as a binary Yes/No response."
subjectparticipant_eligible_studies_schema,participant,laryng_cancer,self_reported_laryng_cancer,enrollment,"Indicates whether the participant self-reported a diagnosis of laryngeal (voice box) cancer, typically recorded as Yes, No, or Unknown."
subjectparticipant_eligible_studies_schema,participant,laryngitis,self_reported_laryngitis,enrollment,"Indicates whether the participant self-reported a diagnosis of laryngitis (inflammation of the larynx/voice box), recorded as Yes or No."
subjectparticipant_eligible_studies_schema,participant,mtd,self_reported_mtd,enrollment,"Indicates whether the participant self-reported a current or prior diagnosis of Muscle Tension Dysphonia (MTD), a voice disorder due to excessive laryngeal muscle tension, recorded as yes/no."
subjectparticipant_eligible_studies_schema,participant,ocd,self_reported_ocd,enrollment,"Indicates whether the participant self-reported a diagnosis of Obsessive‑Compulsive Disorder (OCD), typically recorded as Yes or No."
subjectparticipant_eligible_studies_schema,participant,osa,self_reported_osa,enrollment,"Indicates whether the participant self-reported a diagnosis of obstructive sleep apnea (OSA); common responses are Yes/No and may also note severity or treatment (e.g., CPAP)."
subjectparticipant_eligible_studies_schema,participant,other_psych,self_reported_other_psych,enrollment,"Indicates whether the participant self-reported a diagnosis of any psychiatric disorder not captured elsewhere in the form, specifying the diagnosis."
subjectparticipant_eligible_studies_schema,participant,panic,self_reported_panic,enrollment,"Indicates whether the participant self-reported a diagnosis of Panic Disorder (typically recorded as Yes, No, or Unknown/not assessed)."
