schema_name_source,schema_name,column_name_source,column_name,group,description
confounders_schema,confounders,supplemental_oxygen,supplemental_oxygen,confounders,"Indicates whether the participant was receiving supplemental oxygen at the time of assessment (yes/no); when provided, includes delivery method and flow rate in liters per minute."
confounders_schema,confounders,surgery,surgery,confounders,"Indicates whether the participant has a history of surgical procedures (yes/no); when applicable, record the procedure type and date (YYYY-MM-DD)."
confounders_schema,confounders,swallowing_disorder,swallowing_disorder,confounders,"Indicates whether the participant has a swallowing disorder (dysphagia), recorded as present/absent (yes/no)."
confounders_schema,confounders,talk_therapy_mental_health_prof,talk_therapy_mental_health_prof,confounders,"Indicates whether the participant has received talk therapy from a mental health professional (e.g., social worker, psychologist, or psychiatrist); responses are Yes or No."
confounders_schema,confounders,tell_us_about_you_health_header,tell_us_about_you_health_header,confounders,Introductory prompt instructing participants to report current and past medical conditions that could have long-term effects on their voice.
confounders_schema,confounders,thyroid_cancer,thyroid_cancer,confounders,Indicates whether the participant has ever been diagnosed with thyroid cancer (Yes/No).
confounders_schema,confounders,thyroid_disease,thyroid_disease,confounders,"Whether the participant has a diagnosed thyroid condition (e.g., thyroid polyp, Hashimoto’s, Graves’ disease, hypothyroidism, hyperthyroidism); typically recorded as Yes/No, with the specific condition noted if applicable."
confounders_schema,confounders,thyroid_replacement,thyroid_replacement,confounders,"Indicates whether the participant is currently taking thyroid hormone replacement medication (e.g., levothyroxine); responses are typically Yes/No."
confounders_schema,confounders,times_use_nicotine_per_day,times_use_nicotine_per_day,confounders,"Participant’s current average number of nicotine uses per day, recorded as a numeric value (times/day)."
confounders_schema,confounders,tired_measure,tired_measure,confounders,"Self-reported current level of tiredness on a 0–10 numeric scale, where 0 = not tired at all and 10 = extremely tired."
confounders_schema,confounders,today_consume_caffeinated_products,today_consume_caffeinated_products,confounders,"Types of caffeinated products consumed today (e.g., coffee, tea, soda, energy drinks, chocolate, caffeinated medications), with multiple selections allowed."
confounders_schema,confounders,today_consume_other_specify,today_consume_other_specify,confounders,Free-text field where participants specify any other substances or items they consumed today that were not listed among the provided response options.
confounders_schema,confounders,today_drink_caffeinated_products,today_drink_caffeinated_products,confounders,"Indicates whether the participant consumed coffee or any other caffeinated products today (Yes/No), including items such as coffee, tea, soda, or energy drinks."
confounders_schema,confounders,tonsillectomy,tonsillectomy,confounders,"Indicates whether the participant has ever had a tonsillectomy (surgical removal of the tonsils), with or without adenoidectomy, typically recorded as Yes/No."
confounders_schema,confounders,tracheostomy,tracheostomy,confounders,Indicates whether the participant currently has a tracheostomy tube (recorded as yes/no for presence vs. absence).
confounders_schema,confounders,traumatic_brain_injury,traumatic_brain_injury,confounders,"Whether the participant has a history of traumatic brain injury (TBI), typically recorded as ""Yes"" or ""No"" and, when available, accompanied by severity and date of injury."
confounders_schema,confounders,tuberculosis,tuberculosis,confounders,"Whether the participant has a current or past diagnosis of tuberculosis, recorded as ""Yes"", ""No"", or ""Unknown""."
confounders_schema,confounders,typical_day_consume_caffeinated_products,typical_day_consume_caffeinated_products,confounders,"Indicates which types of caffeinated products a participant typically consumes (e.g., coffee, tea, soda, energy drinks, chocolate, none, other)."
confounders_schema,confounders,typical_day_consume_other_specify,typical_day_consume_other_specify,confounders,"Free-text field where participants describe any ""Other"" food, drink, or substance they consume on a typical day that was not listed among the predefined options."
confounders_schema,confounders,typical_day_drink_caffeinated_products,typical_day_drink_caffeinated_products,confounders,"Indicates whether the participant typically consumes coffee or other caffeinated products on a usual day (e.g., tea, energy drinks, soda, caffeine pills); responses: Yes/No."
confounders_schema,confounders,unit,unit,confounders,"Unit of measurement for the associated confounder value (for example: ""kg"", ""cm"", ""m"", ""lb"", ""s"", ""min"", or ""years"")."
confounders_schema,confounders,used_drugs,used_drugs,confounders,"Indicates whether the participant has ever used marijuana, cocaine or crack, or other (non-prescribed) drugs (lifetime use), recorded as Yes/No."
confounders_schema,confounders,used_nicotine_products_in_entire_life,used_nicotine_products_in_entire_life,confounders,"Whether the participant has used any nicotine products (e.g., cigarettes, e‑cigarettes, chewing tobacco) at least 100 times in their lifetime (Yes/No)."
confounders_schema,confounders,used_substance_on_your_own,used_substance_on_your_own,confounders,Indicates whether the participant has ever (lifetime) used prescription medications on their own without a doctor's prescription or in larger amounts or for longer than prescribed (Yes/No).
confounders_schema,confounders,vagal_nerve_stimulator,vagal_nerve_stimulator,confounders,Indicates whether the participant currently has a vagal nerve stimulator device (Yes/No).
confounders_schema,confounders,velopharyngeal_insufficiency,velopharyngeal_insufficiency,confounders,"Indicates whether velopharyngeal insufficiency (problems with closing the soft palate causing hyponasality, nasal air emission, etc.) is present, recorded as present/absent/unknown."
confounders_schema,confounders,vocal_cord_dysfunction,vocal_cord_dysfunction,confounders,"Whether the participant has vocal cord dysfunction (paradoxical vocal fold motion), i.e., a diagnosis or self‑report of the condition, recorded as yes/no/unknown."
confounders_schema,confounders,vocal_fold_hemorrhage,vocal_fold_hemorrhage,confounders,"Indicates whether the participant has a vocal fold hemorrhage (bleeding of the vocal cords), typically recorded as yes/no (with options for unknown or not assessed)."
confounders_schema,confounders,voice_activity_v2,voice_activity_v2,confounders,"Which jobs or hobbies require the participant to use their voice for many hours a day (multiple selections allowed), e.g., teacher, singer, actor, coach, clergy, or call‑center worker."
confounders_schema,confounders,weight,weight,confounders,"Participant's body weight at the time of assessment, recorded as a numeric value in kilograms (kg)."
confounders_schema,confounders,years_used_nicotine,years_used_nicotine,confounders,"Total number of years the participant has used nicotine, recorded as a numeric value in years (0 if never used)."
copd_and_asthma_schema,copd_and_asthma,diagnosis_ca_10_pack_year_tobacco_cigarette,diagnosis_ca_10_pack_year_tobacco_cigarette,diagnosis,Indicates whether the participant has a tobacco cigarette smoking history of at least 10 pack‑years (response: Yes/No).
copd_and_asthma_schema,copd_and_asthma,diagnosis_ca_absolute_eosinophil_count,diagnosis_ca_absolute_eosinophil_count,diagnosis,"Highest absolute eosinophil count measured in the past 12 months, reported as a numeric value in cells per microliter (µL)."
copd_and_asthma_schema,copd_and_asthma,diagnosis_ca_act_score,diagnosis_ca_act_score,diagnosis,"Total Asthma Control Test (ACT) score from the most recent visit (numeric, range 5–25, with higher scores indicating better asthma control)."
copd_and_asthma_schema,copd_and_asthma,diagnosis_ca_asthma,diagnosis_ca_asthma,diagnosis,"Whether the participant has a history of confirmed expiratory airflow variability (Yes/No), defined as an increase in FEV1 or FVC of ≥200 mL and ≥12% from baseline after bronchodilator or after ≥4 weeks of inhaled corticosteroid therapy, or a positive bronchial challenge test."
copd_and_asthma_schema,copd_and_asthma,diagnosis_ca_asthma_has_subtype,diagnosis_ca_asthma_has_subtype,diagnosis,Indicates whether the participant has a specific asthma subtype (Yes/No).
copd_and_asthma_schema,copd_and_asthma,diagnosis_ca_asthma_probability,diagnosis_ca_asthma_probability,diagnosis,"Indicates whether the clinician assessed the clinical probability of asthma as high (e.g., allergic or eosinophilic phenotype with variable symptoms such as wheeze, cough, chest tightness, or dyspnea); typically recorded as Yes/No/Unknown."
copd_and_asthma_schema,copd_and_asthma,diagnosis_ca_asthma_subtype,diagnosis_ca_asthma_subtype,diagnosis,"Asthma subtype(s) reported for the participant—select all that apply (e.g., allergic, non‑allergic, exercise‑induced, occupational)."
copd_and_asthma_schema,copd_and_asthma,diagnosis_ca_asthma_subtype_other,diagnosis_ca_asthma_subtype_other,diagnosis,"Free-text field for specifying the asthma subtype when ""Other"" was chosen (e.g., occupational asthma, exercise-induced asthma)."
copd_and_asthma_schema,copd_and_asthma,diagnosis_ca_ats_ers_criteria_fev1,diagnosis_ca_ats_ers_criteria_fev1,diagnosis,Indicates whether spirometry shows the FEV1/FVC ratio is below the 5th percentile or has a z‑score ≤ −1.65 (Yes/No).
copd_and_asthma_schema,copd_and_asthma,diagnosis_ca_ats_ers_criteria_fvc,diagnosis_ca_ats_ers_criteria_fvc,diagnosis,"Whether the participant’s forced vital capacity (FVC) meets the abnormal threshold — i.e., FVC value < 0.7 (as recorded) or FVC z‑score ≤ -1.65 — recorded as Yes/No."
copd_and_asthma_schema,copd_and_asthma,diagnosis_ca_cat_score,diagnosis_ca_cat_score,diagnosis,"Total COPD Assessment Test (CAT) score: the 8‑item questionnaire total (0–40 points), with higher scores indicating greater respiratory symptom burden and worse health status."
copd_and_asthma_schema,copd_and_asthma,diagnosis_ca_copd,diagnosis_ca_copd,diagnosis,Indicates whether the participant has a chronic obstructive pulmonary disease (COPD) subtype (Yes/No).
copd_and_asthma_schema,copd_and_asthma,diagnosis_ca_copd_asthma,diagnosis_ca_copd_asthma,diagnosis,"Indicates whether the participant has COPD, asthma, both conditions, or neither (responses: COPD, asthma, both, none)."
copd_and_asthma_schema,copd_and_asthma,diagnosis_ca_copd_subtype,diagnosis_ca_copd_subtype,diagnosis,"COPD subtype(s) reported for the participant; multiple selections allowed (e.g., chronic bronchitis, emphysema, alpha‑1 antitrypsin deficiency, other)."
copd_and_asthma_schema,copd_and_asthma,diagnosis_ca_current_smoker,diagnosis_ca_current_smoker,diagnosis,"Indicates whether the participant currently smokes tobacco (e.g., cigarettes) with responses typically recorded as Yes or No."
copd_and_asthma_schema,copd_and_asthma,diagnosis_ca_environmental_allergy_history,diagnosis_ca_environmental_allergy_history,diagnosis,"Indicates whether the participant has a strong history of environmental allergies (e.g., pollen, dust, mold, or pet dander); typically recorded as yes or no."
copd_and_asthma_schema,copd_and_asthma,diagnosis_ca_feno_value,diagnosis_ca_feno_value,diagnosis,"Fractional exhaled nitric oxide (FeNO), a biomarker of airway inflammation, recorded as a numeric value in parts per billion (ppb)."
copd_and_asthma_schema,copd_and_asthma,diagnosis_ca_feno_within_12_months,diagnosis_ca_feno_within_12_months,diagnosis,Indicates whether the participant has a recorded fractional exhaled nitric oxide (FeNO) measurement within the past 12 months (Yes/No); FeNO is typically reported in parts per billion (ppb).
copd_and_asthma_schema,copd_and_asthma,diagnosis_ca_fev1,diagnosis_ca_fev1,diagnosis,"Participant's FEV1 (forced expiratory volume in one second) expressed as percent of the predicted value, reported as a percentage (if known)."
copd_and_asthma_schema,copd_and_asthma,diagnosis_ca_gold_group,diagnosis_ca_gold_group,diagnosis,"Clinical GOLD Group: the COPD classification reflecting symptom burden and exacerbation risk, recorded as A, B, or E (E indicates high exacerbation risk)."
copd_and_asthma_schema,copd_and_asthma,diagnosis_ca_ics_dosage,diagnosis_ca_ics_dosage,diagnosis,"Indicates the participant’s inhaled corticosteroid (ICS) dose category, recorded as low, medium, or high."
copd_and_asthma_schema,copd_and_asthma,diagnosis_ca_mmrc_grade_score,diagnosis_ca_mmrc_grade_score,diagnosis,"Modified Medical Research Council (mMRC) dyspnea grade (integer 0–4) indicating breathlessness severity, where 0 = only breathless with strenuous exercise and 4 = too breathless to leave the house or breathless when dressing."
copd_and_asthma_schema,copd_and_asthma,diagnosis_ca_moderate_exacerbations_count,diagnosis_ca_moderate_exacerbations_count,diagnosis,Count of moderate exacerbations in the past 12 months—defined as episodes requiring a course of oral corticosteroids (OCS)—recorded as an integer number of exacerbations.
copd_and_asthma_schema,copd_and_asthma,diagnosis_ca_pft_file,diagnosis_ca_pft_file,diagnosis,"Pulmonary function test (PFT) report (e.g., spirometry) for COPD/asthma diagnosis containing measurements such as FEV1 and FVC, typically reported in liters and as percent predicted."
copd_and_asthma_schema,copd_and_asthma,diagnosis_ca_pft_lung,diagnosis_ca_pft_lung,diagnosis,Indicates whether the participant underwent a full pulmonary function test (PFT) that included lung volume measurements (Yes/No).
copd_and_asthma_schema,copd_and_asthma,diagnosis_ca_pft_within_6_months,diagnosis_ca_pft_within_6_months,diagnosis,Indicates whether the participant has undergone a pulmonary function test (PFT) within the past 6 months (Yes/No).
copd_and_asthma_schema,copd_and_asthma,diagnosis_ca_pharmacologic_treatment,diagnosis_ca_pharmacologic_treatment,diagnosis,"Participant's current pharmacologic treatments for COPD or asthma (select all that apply), with options such as inhaled short‑acting beta‑agonist (SABA), long‑acting beta‑agonist (LABA), inhaled corticosteroid (ICS), oral corticosteroid, leukotriene modifier, anticholinergic/long‑acting muscarinic antagonist (LAMA), combination inhaler, biologic therapy, systemic immunosuppressant, none, or other (specify)."
copd_and_asthma_schema,copd_and_asthma,diagnosis_ca_pulmonary_symptoms,diagnosis_ca_pulmonary_symptoms,diagnosis,"Lists which pulmonary symptoms the participant reports (e.g., cough, wheeze, shortness of breath), with multiple symptoms allowed to be selected."
copd_and_asthma_schema,copd_and_asthma,diagnosis_ca_responsiveness_criteria,diagnosis_ca_responsiveness_criteria,diagnosis,Indicates whether the participant met bronchodilator responsiveness criteria—defined as an increase in FEV1 or FVC of ≥200 mL and ≥12% from baseline after bronchodilator administration (Yes/No).
copd_and_asthma_schema,copd_and_asthma,diagnosis_ca_restrictive,diagnosis_ca_restrictive,diagnosis,"Whether the participant shows a restrictive ventilatory defect, defined as total lung capacity (TLC) below the 5th percentile or a TLC z‑score ≤ −1.65 (yes/no/unknown)."
copd_and_asthma_schema,copd_and_asthma,diagnosis_ca_severe_exacerbations_count,diagnosis_ca_severe_exacerbations_count,diagnosis,Count of severe exacerbations requiring hospitalization in the past 12 months (integer count; 0 = none).
copd_and_asthma_schema,copd_and_asthma,diagnosis_ca_significant_inhalation_exposure_history,diagnosis_ca_significant_inhalation_exposure_history,diagnosis,"Indicates whether the participant has any other significant inhalation exposures (e.g., occupational or environmental), recorded as Yes/No with details provided if Yes."
copd_and_asthma_schema,copd_and_asthma,diagnosis_ca_significant_inhalation_exposure_history_explanation,diagnosis_ca_significant_inhalation_exposure_history_explanation,diagnosis,"Free-text description of any significant inhalation exposures relevant to COPD or asthma (e.g., occupational dusts, chemical fumes, biomass or tobacco smoke), including exposure type, timing, and duration where known."
copd_and_asthma_schema,copd_and_asthma,diagnosis_ca_significant_inhalation_exposure_history_explanation_other,diagnosis_ca_significant_inhalation_exposure_history_explanation_other,diagnosis,"Free-text field to specify other significant inhalation exposures (for example, biomass smoke, occupational dusts, chemical fumes, or secondhand smoke) not captured by the listed exposure options."
copd_and_asthma_schema,copd_and_asthma,diagnosis_ca_spirometry_ce,diagnosis_ca_spirometry_ce,diagnosis,"Indicates whether spirometry demonstrated clinical evidence of airway obstruction (responses: Yes, No, or Unknown/not performed)."
copd_and_asthma_schema,copd_and_asthma,diagnosis_ca_spirometry_test,diagnosis_ca_spirometry_test,diagnosis,Whether the participant has ever undergone a spirometry test (response: Yes/No).
copd_and_asthma_schema,copd_and_asthma,diagnosis_ca_spirometry_verification,diagnosis_ca_spirometry_verification,diagnosis,"Specifies which verification standard was used to validate the spirometry test, with response options including ""ATS/ERS"" or the alternative verification method (choose ""ATS/ERS"" if both are available)."
copd_and_asthma_schema,copd_and_asthma,part_copd,part_copd,diagnosis,"Participant-reported COPD-related diagnoses—select all that apply (checkboxes), for example COPD, emphysema, chronic bronchitis, or none."
custom_affect_scale_schema,custom_affect_scale,agitated,agitated,questionnaire,"Indicates whether the participant appears agitated (restless, fidgety, pacing, or unable to sit still), typically recorded as present/absent or on the study’s affect severity scale."
custom_affect_scale_schema,custom_affect_scale,concentrated,concentrated,questionnaire,"Self-rated level of concentration (ability to focus, not distracted or inattentive), recorded on the study's affect scale with higher values indicating greater concentration."
custom_affect_scale_schema,custom_affect_scale,custom_affect_scale_completed_at,custom_affect_scale_completed_at,questionnaire,"Date and time the participant completed the custom affect scale questionnaire, recorded as an ISO 8601 datetime (e.g., 2023-05-12T14:30:00+00:00)."
custom_affect_scale_schema,custom_affect_scale,custom_affect_scale_duration,custom_affect_scale_duration,questionnaire,"Total time, in seconds, that the participant took to complete the questionnaire."
custom_affect_scale_schema,custom_affect_scale,custom_affect_scale_session_id,custom_affect_scale_session_id,questionnaire,"Unique alphanumeric identifier for the session when the custom affect scale was completed, used to link responses to a specific study visit or recording."
custom_affect_scale_schema,custom_affect_scale,custom_affect_scale_started_at,custom_affect_scale_started_at,questionnaire,"Date and time when the custom affect scale questionnaire was started, recorded as an ISO 8601 date-time (YYYY-MM-DDThh:mm:ss, with time zone if available)."
custom_affect_scale_schema,custom_affect_scale,desire_to_escape,desire_to_escape,questionnaire,"Self-reported intensity of the desire to escape your thoughts and/or feelings, recorded as a numeric or Likert-style rating."
custom_affect_scale_schema,custom_affect_scale,energetic,energetic,questionnaire,"Self-reported level of feeling energetic at the time of assessment, recorded on a numeric/Likert scale with higher values indicating greater energy."
custom_affect_scale_schema,custom_affect_scale,irritated,irritated,questionnaire,"Self-reported current level of irritation or anger directed at something or someone, recorded as an intensity on the study's affect scale (higher values indicate greater irritation/anger)."
custom_affect_scale_schema,custom_affect_scale,joyful,joyful,questionnaire,"Self-reported level of feeling joyful at the time of assessment, recorded on the study's affect scale with higher values indicating greater joy."
custom_affect_scale_schema,custom_affect_scale,lack_of_pleasure,lack_of_pleasure,questionnaire,"Participant's self-reported degree of lack of pleasure in activities they typically enjoy, recorded as a numeric (Likert-type) rating on the study's affect scale."
custom_affect_scale_schema,custom_affect_scale,lonely,lonely,questionnaire,"Self-reported level of feeling lonely or socially isolated, recorded on an ordinal scale (ordered categories such as ""never"" to ""always"")."
custom_affect_scale_schema,custom_affect_scale,motivated,motivated,questionnaire,"Participant’s current level of motivation or interest, recorded as a numeric score on the study’s custom affect scale (higher scores indicate greater motivation)."
custom_affect_scale_schema,custom_affect_scale,relaxed,relaxed,questionnaire,"Self-reported degree to which the participant felt relaxed or calm at the time of assessment, typically recorded as a numeric or Likert rating with higher values indicating greater relaxation."
custom_affect_scale_schema,custom_affect_scale,sad_or_down,sad_or_down,questionnaire,"Participant-reported experience of feeling ""sad or down,"" indicating presence and/or severity and typically recorded as a categorical or numeric rating (for example, yes/no or a 0–4 Likert scale)."
custom_affect_scale_schema,custom_affect_scale,tired,tired,questionnaire,"Self-reported level of tiredness or fatigue recorded on the study's affect scale (e.g., numeric or Likert rating), with higher values indicating greater fatigue."
custom_affect_scale_schema,custom_affect_scale,worried,worried,questionnaire,"Self-reported level of feeling worried or anxious at the time of assessment, recorded on a Likert-type scale (e.g., none/minimal to extreme/severe)."
d_control_schema,control,diagnosis_c_ac,diagnosis_c_ac,diagnosis,"Assessor's judgment, based on clinical assessment and listening to the participant's voice, about whether the participant has a condition affecting their speech or voice (Yes / No / Uncertain)."
d_control_schema,control,diagnosis_c_ac_specified,diagnosis_c_ac_specified,diagnosis,"Free-text field to record the exact diagnosis the participant provided when they selected ""Other"" on the diagnosis list."
demographics_schema,demographics,asian_race,asian_race,demographics,Indicates whether the participant identifies their race as Asian (yes/no).
demographics_schema,demographics,black_race,black_race,demographics,Indicates whether the participant self-identifies as Black or African American (binary response: Yes/No).
demographics_schema,demographics,canadian_race,canadian_race,demographics,"Indicates whether the participant self-identifies as Canadian Indigenous/Aboriginal (e.g., First Nations, Métis, or Inuit), typically recorded as yes/no or by specific Indigenous group."
demographics_schema,demographics,children,children,demographics,Indicates whether the participant has one or more children (response: yes/no).
demographics_schema,demographics,cognition,cognition,demographics,"Whether the participant reports serious difficulty concentrating, remembering, or making decisions because of a physical, mental, or emotional condition (response: Yes/No)."
demographics_schema,demographics,colorblind,colorblind,demographics,"Indicates whether the participant reports having a color vision deficiency (colorblindness), typically recorded as ""Yes"" or ""No."""
demographics_schema,demographics,country,country,demographics,"Participant's country of residence, recorded as the country's name or a standardized country code (e.g., ""United States"" or ""US"")."
demographics_schema,demographics,demographics_completed_at,demographics_completed_at,demographics,"Date and time when the demographics questionnaire was completed, recorded as a timestamp in ISO 8601 date-time format (e.g., YYYY-MM-DDThh:mm:ssZ)."
demographics_schema,demographics,demographics_duration,demographics_duration,demographics,"Total elapsed time, in seconds, from when the participant began the questionnaire to when they completed it."
demographics_schema,demographics,demographics_session_id,demographics_session_id,demographics,"Unique alphanumeric identifier assigned to each participant session to distinguish and link data from that specific recording (e.g., session code or UUID)."
demographics_schema,demographics,demographics_started_at,demographics_started_at,demographics,"Date and time when the demographics questionnaire was started, recorded as an ISO 8601 timestamp (date-time, e.g., YYYY-MM-DDThh:mm:ss with timezone)."
demographics_schema,demographics,edu_level,edu_level,demographics,"Participant's highest completed level of education, reported using categories such as less than high school, high school diploma or GED, some college, associate degree, bachelor's degree, master's degree, professional degree (e.g., MD, JD), or doctorate (PhD)."
demographics_schema,demographics,employ_status,employ_status,demographics,"Participant employment status (select all that apply), e.g., employed full-time or part-time, self-employed, student, unemployed, retired, homemaker, disabled, active military, contractor, or other."
