schema_name_source,schema_name,column_name_source,column_name,group,description
acoustic_task_schema,acoustic_task,acoustic_task_cohort,acoustic_task_cohort,task,"Participant's cohort assignment for the acoustic task, recorded as a categorical label (e.g., ""Cohort A"", ""Cohort B"", ""pilot"")."
acoustic_task_schema,acoustic_task,acoustic_task_duration,acoustic_task_duration,task,"Total length of the acoustic task recording, measured in seconds."
acoustic_task_schema,acoustic_task,acoustic_task_id,acoustic_task_id,task,"Alphanumeric identifier for the specific acoustic task performed during the session (e.g., sustained vowel phonation, read passage, sentence repetition)."
acoustic_task_schema,acoustic_task,acoustic_task_name,acoustic_task_name,task,"Short descriptive name of the acoustic task performed during the recording (e.g., ""sustained vowel,"" ""reading passage,"" ""spontaneous speech,"" or ""diadochokinetic syllables"")."
acoustic_task_schema,acoustic_task,acoustic_task_session_id,acoustic_task_session_id,task,"Unique alphanumeric identifier for the participant session/visit during which the acoustic task was recorded, used to link recordings and data from the same session."
acoustic_task_schema,acoustic_task,acoustic_task_status,acoustic_task_status,task,"Indicates the completion status of the participant's acoustic task, with typical responses such as completed, in progress, not started, or failed."
adhd_adult_schema,adhd_adult,adhd_duration,adhd_duration,diagnosis,"Total time, in seconds, taken by the participant to complete the adult ADHD questionnaire."
adhd_adult_schema,adhd_adult,adhd_session_id,adhd_session_id,diagnosis,"Unique session identifier for the adult ADHD visit, recorded as an alphanumeric code used to link data collected during the same study session."
adhd_adult_schema,adhd_adult,avoidance,avoidance,diagnosis,"How often the participant avoids or delays starting tasks that require a lot of thought, reported on a frequency scale (e.g., never to very often)."
adhd_adult_schema,adhd_adult,careless,careless,diagnosis,"Self-reported frequency of making careless mistakes when working on boring or difficult projects, recorded on a frequency scale (e.g., Never to Very Often)."
adhd_adult_schema,adhd_adult,difficulty_attention,difficulty_attention,diagnosis,"Self-reported frequency of having difficulty sustaining attention when performing boring or repetitive tasks, recorded on a categorical frequency scale (e.g., Never to Very Often)."
adhd_adult_schema,adhd_adult,difficulty_concentrating,difficulty_concentrating,diagnosis,"Self-reported frequency of having difficulty concentrating on what others say to you even when they are speaking directly, recorded on a frequency scale (e.g., never, rarely, sometimes, often, very often)."
adhd_adult_schema,adhd_adult,difficulty_unwinding,difficulty_unwinding,diagnosis,"Self-reported frequency of difficulty unwinding and relaxing when you have time to yourself, recorded on a frequency scale (e.g., never to very often)."
adhd_adult_schema,adhd_adult,difficulty_waiting,difficulty_waiting,diagnosis,"Self-reported frequency of having difficulty waiting your turn in situations that require turn-taking, typically recorded on a frequency scale (e.g., never to very often)."
adhd_adult_schema,adhd_adult,distracted,distracted,diagnosis,"Self-reported frequency of becoming distracted by surrounding activity or noise, rated on a frequency scale (e.g., ""never"" to ""very often"")."
adhd_adult_schema,adhd_adult,fidget,fidget,diagnosis,"How often the person fidgets or squirms with their hands or feet when required to sit for a long time, rated on a frequency scale (e.g., Never → Very Often)."
adhd_adult_schema,adhd_adult,finish_other_sent,finish_other_sent,diagnosis,"Self-reported frequency of finishing other people's sentences during conversation, typically recorded on a Likert frequency scale (e.g., never to very often)."
adhd_adult_schema,adhd_adult,interrupt_others,interrupt_others,diagnosis,"Self-reported frequency of interrupting others when they are busy, recorded on a categorical frequency scale (e.g., never, rarely/sometimes, often)."
adhd_adult_schema,adhd_adult,misplace,misplace,diagnosis,"Frequency of misplacing or having difficulty finding items at home or at work, recorded on a frequency scale (e.g., never, rarely, sometimes, often, very often)."
adhd_adult_schema,adhd_adult,overly_active,overly_active,diagnosis,"Self-reported frequency of feeling overly active and compelled to do things as if driven by a motor, rated on a frequency scale (e.g., Never, Rarely, Sometimes, Often, Very Often)."
adhd_adult_schema,adhd_adult,remain_seated,remain_seated,diagnosis,"Frequency of leaving one’s seat during meetings or other situations when remaining seated is expected, reported on a Likert frequency scale (e.g., never to very often)."
adhd_adult_schema,adhd_adult,remembering_appt,remembering_appt,diagnosis,"Self-reported frequency of having problems remembering appointments or obligations, recorded on a categorical frequency scale (e.g., never to very often)."
adhd_adult_schema,adhd_adult,restless,restless,diagnosis,"Self-reported frequency of feeling restless or fidgety, recorded on a categorical scale (e.g., never, rarely, sometimes, often, very often)."
adhd_adult_schema,adhd_adult,talking_too_much,talking_too_much,diagnosis,"Self-reported frequency of talking too much in social situations, recorded on a Likert-style scale (e.g., Never, Rarely, Sometimes, Often, Very Often)."
adhd_adult_schema,adhd_adult,things_in_order,things_in_order,diagnosis,"Self-reported frequency of having difficulty getting things in order when completing tasks that require organization, recorded on a frequency scale (e.g., Never, Rarely, Sometimes, Often, Very Often)."
adhd_adult_schema,adhd_adult,wrapping_up,wrapping_up,diagnosis,"Frequency of difficulty finishing the final details of a project after the challenging parts are completed, recorded on a frequency scale (e.g., never to very often)."
airway_stenosis_schema,airway_stenosis,diagnosis_as_as,diagnosis_as_as,diagnosis,"Indicates whether the participant has audible stridor—a high‑pitched, noisy breathing sound—either at rest or while talking; responses: Yes or No."
airway_stenosis_schema,airway_stenosis,diagnosis_as_as_c,diagnosis_as_as_c,diagnosis,"Indicates whether the patient has stridor and, if present, its timing/type (e.g., inspiratory, expiratory, or biphasic)."
airway_stenosis_schema,airway_stenosis,diagnosis_as_as_s,diagnosis_as_as_s,diagnosis,"Subjective rating by the examiner of stridor severity (e.g., none, mild, moderate, or severe)."
airway_stenosis_schema,airway_stenosis,diagnosis_as_ds,diagnosis_as_ds,diagnosis,"Specific subtype of the patient's airway stenosis diagnosis (for example: idiopathic, traumatic, iatrogenic, or congenital)."
airway_stenosis_schema,airway_stenosis,diagnosis_as_ds_ac,diagnosis_as_ds_ac,diagnosis,"Aziz classification grade indicating the severity of supraglottic stenosis, recorded as an ordinal grade (severity level)."
airway_stenosis_schema,airway_stenosis,diagnosis_as_ds_ac_grade_4,diagnosis_as_ds_ac_grade_4,diagnosis,Indicates whether the patient's supraglottic airway stenosis is classified as Grade 4 according to the Aziz classification (response: Yes/No).
airway_stenosis_schema,airway_stenosis,diagnosis_as_ds_ac_ref,diagnosis_as_ds_ac_ref,diagnosis,"Aziz Classification grade for supraglottic stenosis, recorded as an ordinal rating (e.g., Grade I–IV) where higher grades indicate more severe airway narrowing."
airway_stenosis_schema,airway_stenosis,diagnosis_as_ds_agw,diagnosis_as_ds_agw,diagnosis,"Cohen classification (Type I–IV) of anterior glottic web severity, indicating the extent of anterior vocal fold fusion."
airway_stenosis_schema,airway_stenosis,diagnosis_as_ds_bc,diagnosis_as_ds_bc,diagnosis,"Degree of airway stenosis categorized by the Bogdasarian classification (stages I–IV, with higher stages indicating greater severity)."
airway_stenosis_schema,airway_stenosis,diagnosis_as_ds_bc_ref,diagnosis_as_ds_bc_ref,diagnosis,"Bogdasarian grade (I–IV) indicating the categorical severity of airway stenosis, with higher grades representing greater narrowing of the airway."
airway_stenosis_schema,airway_stenosis,diagnosis_as_ds_bvfi_gs,diagnosis_as_ds_bvfi_gs,diagnosis,"Subtype of airway diagnosis for patients with bilateral vocal fold immobility (BVFI) or glottic stenosis, recorded as a categorical value indicating BVFI or the specific glottic stenosis subtype (e.g., anterior, posterior, concentric, other/unspecified)."
airway_stenosis_schema,airway_stenosis,diagnosis_as_ds_bvfi_gs_other,diagnosis_as_ds_bvfi_gs_other,diagnosis,Free-text field for specifying any other airway stenosis diagnosis not covered by the listed options.
airway_stenosis_schema,airway_stenosis,diagnosis_as_ds_cc_ref,diagnosis_as_ds_cc_ref,diagnosis,"Cohen classification of an anterior glottic web (Type I–IV), recorded as Cohen I, II, III, or IV to indicate increasing web size and vocal fold involvement."
airway_stenosis_schema,airway_stenosis,diagnosis_as_ds_eps,diagnosis_as_ds_eps,diagnosis,"Clinician’s subjective estimate of airway stenosis expressed as percent narrowing of the lumen, recorded as a number from 0 to 100%."
airway_stenosis_schema,airway_stenosis,diagnosis_as_ds_mcg,diagnosis_as_ds_mcg,diagnosis,"Degree of subglottic airway narrowing using the Myer–Cotton classification: Grade I (0–50% obstruction), Grade II (51–70% obstruction), Grade III (71–99% obstruction), and Grade IV (complete/100% obstruction)."
airway_stenosis_schema,airway_stenosis,diagnosis_as_ds_mcg_ref,diagnosis_as_ds_mcg_ref,diagnosis,"Ordinal Myer‑Cotton grade indicating percent airway (typically subglottic) obstruction: Grade I = 0–50% obstruction, Grade II = 51–70%, Grade III = 71–99%, Grade IV = 100% (no detectable lumen)."
airway_stenosis_schema,airway_stenosis,diagnosis_as_ds_mluas,diagnosis_as_ds_mluas,diagnosis,"Description of the anatomical level(s) of airway stenosis and their severity, reported as percent luminal narrowing or a clinical grade/scale (e.g., grade 1–4)."
airway_stenosis_schema,airway_stenosis,diagnosis_as_ds_ods,diagnosis_as_ds_ods,diagnosis,"Clinician's subjective overall classification of airway stenosis severity as a categorical rating (e.g., none, mild, moderate, severe)."
airway_stenosis_schema,airway_stenosis,diagnosis_as_etiology,diagnosis_as_etiology,diagnosis,"Underlying cause of the airway stenosis, specified as the primary etiology (e.g., congenital, iatrogenic, traumatic, infectious, autoimmune, neoplastic, or idiopathic)."
airway_stenosis_schema,airway_stenosis,diagnosis_as_etiology_auto_immune,diagnosis_as_etiology_auto_immune,diagnosis,"Indicates whether the cause of the airway stenosis is an autoimmune or granulomatous disease (e.g., granulomatosis with polyangiitis, sarcoidosis), reported as present/absent or by the specific diagnosis."
airway_stenosis_schema,airway_stenosis,diagnosis_as_etiology_other,diagnosis_as_etiology_other,diagnosis,Free-text field to specify any other cause (etiology) of airway stenosis that is not included in the listed response options.
airway_stenosis_schema,airway_stenosis,diagnosis_as_gsd,diagnosis_as_gold_standard_diagnosis,diagnosis,"Indicates whether the participant has airway stenosis confirmed by laryngoscopy, bronchoscopy, or CT imaging (Yes/No)."
airway_stenosis_schema,airway_stenosis,diagnosis_as_gsd_yes,diagnosis_as_gold_standard_diagnosis_yes,diagnosis,"Name or role of the clinician or diagnostic method that confirmed the diagnosis as GSD (e.g., surgeon, pulmonologist, or pathology report)."
airway_stenosis_schema,airway_stenosis,diagnosis_as_pft,diagnosis_as_pft,diagnosis,"Indicates whether the participant underwent pulmonary function testing (e.g., spirometry, lung volumes, diffusion capacity) within the past 3 months; responses: yes or no."
airway_stenosis_schema,airway_stenosis,diagnosis_as_pft_document,diagnosis_as_pft_document,diagnosis,"Scanned or digital pulmonary function test (PFT) report file (e.g., PDF, TIFF, JPEG) documenting the participant's PFT results relevant to the airway stenosis diagnosis."
airway_stenosis_schema,airway_stenosis,diagnosis_as_treatment,diagnosis_as_treatment,diagnosis,"Treatment(s) the participant has received for their airway stenosis (e.g., surgical resection, dilation/bronchoplasty, stent placement, tracheostomy, laser therapy, corticosteroids or other medications, or none)."
airway_stenosis_schema,airway_stenosis,diagnosis_as_treatment_in_office,diagnosis_as_treatment_in_office,diagnosis,"Which in‑office (awake) treatment option(s) were performed for the airway stenosis (one or more may be selected), e.g., steroid injection, endoscopic dilation, topical medication, voice therapy, or observation."
airway_stenosis_schema,airway_stenosis,diagnosis_as_treatment_surgery,diagnosis_as_treatment_surgery,diagnosis,"Type(s) of surgical treatment received for the airway diagnosis, recorded as the procedure(s) performed (e.g., tracheostomy, dilation, laryngotracheoplasty, cricotracheal resection)."
airway_stenosis_schema,airway_stenosis,diagnosis_as_treatment_surgery_other,diagnosis_as_treatment_surgery_other,diagnosis,Free-text description specifying any other surgery performed as treatment for airway stenosis that is not covered by the predefined options.
alzheimers_disease_mild_cognitive_impairme_schema,cognitive_impairment,diagnosis_alz_dementia_mci_ca_adas_cog_score,diagnosis_alz_dementia_mci_ca_adas_cog_score,diagnosis,"Total ADAS‑Cog score (points) assessing global cognitive impairment in Alzheimer's disease, with higher scores indicating greater dysfunction (standard 11‑item range 0–70)."
alzheimers_disease_mild_cognitive_impairme_schema,cognitive_impairment,diagnosis_alz_dementia_mci_ca_mmse_score,diagnosis_alz_dementia_mci_ca_mmse_score,diagnosis,"Total Mini-Mental State Examination (MMSE) score (integer 0–30) measuring global cognitive function, with higher scores indicating better cognitive performance."
alzheimers_disease_mild_cognitive_impairme_schema,cognitive_impairment,diagnosis_alz_dementia_mci_ca_moca_score,diagnosis_alz_dementia_mci_ca_moca_score,diagnosis,"Total score on the Montreal Cognitive Assessment (MoCA), reported in points from 0–30, with higher scores indicating better cognitive function and lower scores suggesting possible mild cognitive impairment or dementia."
alzheimers_disease_mild_cognitive_impairme_schema,cognitive_impairment,diagnosis_alz_dementia_mci_ca_other,diagnosis_alz_dementia_mci_ca_other,diagnosis,Name any other cognitive assessment tool used to evaluate the participant’s cognition (free-text entry specifying the test name(s)).
alzheimers_disease_mild_cognitive_impairme_schema,cognitive_impairment,diagnosis_alz_dementia_mci_ca_other_score,diagnosis_alz_dementia_mci_ca_other_score,diagnosis,Participant's numeric score (in points) on any additional cognitive assessment tool administered to the participant.
alzheimers_disease_mild_cognitive_impairme_schema,cognitive_impairment,diagnosis_alz_dementia_mci_ca_rudas_score,diagnosis_alz_dementia_mci_ca_rudas_score,diagnosis,"Total score on the Rowland Universal Dementia Assessment Scale (RUDAS), range 0–30, with higher values indicating better cognitive performance."
alzheimers_disease_mild_cognitive_impairme_schema,cognitive_impairment,diagnosis_alz_dementia_mci_causes,diagnosis_alz_dementia_mci_causes,diagnosis,"Whether other causes of cognitive or functional changes (including alternative dementia subtypes) have been excluded, recorded as Yes/No."
alzheimers_disease_mild_cognitive_impairme_schema,cognitive_impairment,diagnosis_alz_dementia_mci_ds,diagnosis_alz_dementia_mci_ds,diagnosis,"Current stage/severity of the participant’s cognitive impairment or dementia, recorded categorically (e.g., no impairment, mild cognitive impairment [MCI], or mild/moderate/severe dementia)."
alzheimers_disease_mild_cognitive_impairme_schema,cognitive_impairment,diagnosis_alz_dementia_mci_ds_cdr,diagnosis_alz_dementia_mci_ds_cdr,diagnosis,"Clinical Dementia Rating (CDR) staging subcategory indicating dementia severity, recorded as numeric categories: 0 = no dementia, 0.5 = questionable/mild cognitive impairment, 1 = mild dementia, 2 = moderate dementia, 3 = severe dementia."
alzheimers_disease_mild_cognitive_impairme_schema,cognitive_impairment,diagnosis_alz_dementia_mci_dt,diagnosis_alz_dementia_mci_dt,diagnosis,"Participant's diagnosed cognitive disease type (e.g., Alzheimer's disease, dementia, mild cognitive impairment [MCI], or cognitively normal)."
alzheimers_disease_mild_cognitive_impairme_schema,cognitive_impairment,diagnosis_alz_dementia_mci_dt_other,diagnosis_alz_dementia_mci_dt_other,diagnosis,"Free-text field for specifying the participant's other diagnosis when ""other"" was selected for Alzheimer's disease / dementia / mild cognitive impairment."
alzheimers_disease_mild_cognitive_impairme_schema,cognitive_impairment,diagnosis_alz_dementia_mci_etiology,diagnosis_alz_dementia_mci_etiology,diagnosis,"Suspected or confirmed cause of the participant’s dementia or mild cognitive impairment (e.g., Alzheimer’s disease, vascular, Lewy body, frontotemporal, mixed, or unknown)."
alzheimers_disease_mild_cognitive_impairme_schema,cognitive_impairment,diagnosis_alz_dementia_mci_etiology_gf,diagnosis_alz_dementia_mci_etiology_gf,diagnosis,"Lists genetic factors related to the participant's Alzheimer’s/dementia/MCI etiology (e.g., APOE ε4 carrier status, known pathogenic mutations like APP/PSEN1/PSEN2, familial inheritance, ""none"", or ""unknown"")."
alzheimers_disease_mild_cognitive_impairme_schema,cognitive_impairment,diagnosis_alz_dementia_mci_etiology_gf_other,diagnosis_alz_dementia_mci_etiology_gf_other,diagnosis,"Free-text field for specifying any genetic factor(s) not listed among the provided etiology options when ""Other genetic factors"" was selected for the participant's Alzheimer's disease/dementia/mild cognitive impairment."
alzheimers_disease_mild_cognitive_impairme_schema,cognitive_impairment,diagnosis_alz_dementia_mci_etiology_other,diagnosis_alz_dementia_mci_etiology_other,diagnosis,"Free-text field to specify an alternative etiology for Alzheimer’s disease, dementia, or mild cognitive impairment when “other” was selected."
alzheimers_disease_mild_cognitive_impairme_schema,cognitive_impairment,diagnosis_alz_dementia_mci_etiology_other_medical_conditions,diagnosis_alz_dementia_mci_etiology_other_medical_conditions,diagnosis,"Free-text field to specify which other medical condition(s) contribute to the participant’s Alzheimer’s disease, dementia, or mild cognitive impairment etiology (used when ""other medical conditions"" was selected)."
alzheimers_disease_mild_cognitive_impairme_schema,cognitive_impairment,diagnosis_alz_dementia_mci_gsd,diagnosis_alz_dementia_mci_gold_standard_diagnosis,diagnosis,"Categorical field indicating whether the participant has a diagnosis of Major Neurocognitive Disorder (Alzheimer’s type), Mild Cognitive Impairment, another form of dementia, or no/unknown cognitive disorder (e.g., Alzheimer’s, MCI, other dementia, none/unknown)."
alzheimers_disease_mild_cognitive_impairme_schema,cognitive_impairment,diagnosis_alz_dementia_mci_gsd_clinical_history,diagnosis_alz_dementia_mci_gold_standard_diagnosis_clinical_history,diagnosis,"Free-text clinical history describing the participant’s cognitive symptoms, onset and course, comorbidities, treatments, and other relevant medical details related to Alzheimer’s disease, dementia, mild cognitive impairment, or subjective cognitive decline."
alzheimers_disease_mild_cognitive_impairme_schema,cognitive_impairment,diagnosis_alz_dementia_mci_gsd_cognitive_testing,diagnosis_alz_dementia_mci_gold_standard_diagnosis_cognitive_testing,diagnosis,"Documents whether standardized cognitive testing was administered and, if so, lists the test name(s) and corresponding scores (e.g., MMSE or MoCA total points)."
alzheimers_disease_mild_cognitive_impairme_schema,cognitive_impairment,diagnosis_alz_dementia_mci_gsd_confirmation_method,diagnosis_alz_dementia_mci_gold_standard_diagnosis_confirmation_method,diagnosis,"Methods used to confirm the diagnosis, with options such as clinical assessment, neuropsychological testing, brain imaging (MRI/CT), PET or CSF biomarkers, genetic testing, and review of medical records or informant report."
alzheimers_disease_mild_cognitive_impairme_schema,cognitive_impairment,diagnosis_alz_dementia_mci_gsd_confirmation_method_other,diagnosis_alz_dementia_mci_gold_standard_diagnosis_confirmation_method_other,diagnosis,"If ""Other"" was chosen for how the Alzheimer's disease/dementia/mild cognitive impairment diagnosis was confirmed, provide a brief free-text description of the alternative confirmation method."
alzheimers_disease_mild_cognitive_impairme_schema,cognitive_impairment,diagnosis_alz_dementia_mci_gsd_functional_inventory,diagnosis_alz_dementia_mci_gold_standard_diagnosis_functional_inventory,diagnosis,"Total score from a functional inventory assessing everyday task performance and functional impairment in individuals with Alzheimer's disease or mild cognitive impairment, recorded as item-level ratings and/or a numeric summary (higher scores indicate greater impairment)."
alzheimers_disease_mild_cognitive_impairme_schema,cognitive_impairment,diagnosis_alz_dementia_mci_gsd_other_investigations,diagnosis_alz_dementia_mci_gold_standard_diagnosis_other_investigations,diagnosis,"Free-text description of any other investigations performed (e.g., additional laboratory tests, imaging studies, biomarker assays, or neuropsychological assessments), including relevant details such as test type, date, and results."
alzheimers_disease_mild_cognitive_impairme_schema,cognitive_impairment,diagnosis_alz_dementia_mci_treatment_obtained,diagnosis_alz_dementia_mci_treatment_obtained,diagnosis,"Indicates whether the participant has ever received treatment (e.g., medications, cognitive or behavioral therapies, or other interventions) for Alzheimer’s disease, mild cognitive impairment, or other dementia, recorded as Yes/No."
alzheimers_disease_mild_cognitive_impairme_schema,cognitive_impairment,diagnosis_alz_dementia_mci_treatment_obtained_yes,diagnosis_alz_dementia_mci_treatment_obtained_yes,diagnosis,"Indicates whether the participant has received treatment for Alzheimer's disease, dementia, or mild cognitive impairment (response: Yes/No)."
alzheimers_disease_mild_cognitive_impairme_schema,cognitive_impairment,diagnosis_alz_dementia_mci_treatment_obtained_yes_medications,diagnosis_alz_dementia_mci_treatment_obtained_yes_medications,diagnosis,"Names of medications the participant is taking for Alzheimer’s disease, dementia, or mild cognitive impairment (entered as a free-text list; include dose and frequency when available)."
alzheimers_disease_mild_cognitive_impairme_schema,cognitive_impairment,diagnosis_alz_dementia_mci_treatment_obtained_yes_medications_other,diagnosis_alz_dementia_mci_treatment_obtained_yes_medications_other,diagnosis,"Free-text entry for naming any other medication(s) obtained for treating Alzheimer's disease, dementia, or mild cognitive impairment when ""Other"" was selected."
alzheimers_disease_mild_cognitive_impairme_schema,cognitive_impairment,diagnosis_alz_dementia_mci_treatment_obtained_yes_npi,diagnosis_alz_dementia_mci_treatment_obtained_yes_npi,diagnosis,"Names any non-pharmacological (non-drug) interventions the participant has received for cognitive impairment or dementia (for example, cognitive training, physical/occupational therapy, psychotherapy, speech therapy, exercise programs, or caregiver/caregiver-education support)."
alzheimers_disease_mild_cognitive_impairme_schema,cognitive_impairment,diagnosis_alz_dementia_mci_treatment_obtained_yes_npi_other,diagnosis_alz_dementia_mci_treatment_obtained_yes_npi_other,diagnosis,"Open-text field for specifying other treatment(s) obtained for Alzheimer’s disease, dementia, or mild cognitive impairment when ""Other"" was selected."
amyotrophic_lateral_sclerosis_als_schema,amyotrophic_lateral_sclerosis,diagnosis_als_cp,diagnosis_als_cp,diagnosis,"Free-text description of the participant's ALS clinical features and symptoms, including onset and distribution (e.g., limb vs. bulbar), speech/swallowing difficulties, respiratory involvement, and progression rate."
amyotrophic_lateral_sclerosis_als_schema,amyotrophic_lateral_sclerosis,diagnosis_als_disease_subtype,diagnosis_als_disease_subtype,diagnosis,"Clinical subtype of the participant’s ALS (e.g., bulbar-onset, limb-onset, respiratory-onset, flail-limb, primary lateral sclerosis, progressive muscular atrophy, or other/unspecified)."
amyotrophic_lateral_sclerosis_als_schema,amyotrophic_lateral_sclerosis,diagnosis_als_disease_subtype_familial,diagnosis_als_disease_subtype_familial,diagnosis,"If the participant has familial ALS, name the known causative genetic mutation (e.g., SOD1, C9orf72, TARDBP), entered as free-text."
amyotrophic_lateral_sclerosis_als_schema,amyotrophic_lateral_sclerosis,diagnosis_als_dp,diagnosis_als_dp,diagnosis,"Brief summary of the participant’s current ALS stage and recent progression, e.g., stage (early/moderate/advanced), time since symptom onset (months), affected regions (bulbar vs limb), and whether symptoms are stable, improving, or worsening."
amyotrophic_lateral_sclerosis_als_schema,amyotrophic_lateral_sclerosis,diagnosis_als_etiology,diagnosis_als_etiology,diagnosis,"Suspected or confirmed etiology of the participant’s ALS, e.g., sporadic, familial/genetic (specific ALS gene if known), environmental/other, or unknown."
